"","id","title","description","publishTime","kind_stats","duration_seconds","viewCount","likeCount","commentCount","pull_date"
"607","lh61MVUxJt0","The History Of Pewdiepie In 2 Minutes","The history of Pewdiepie on Youtube! This video took forever to make and now I have dozen's of pewdiepie's videos on my ...",2015-07-14 10:00:01,"youtube#video",126,214221,6657,561,"2023-12-11 00:06:37.374405+00:00"
"608","yWnmEPgLroQ","TWITCH STREAMERS REACT TO RECEIVING THOUSANDS FROM SAME GUY!","This is a compilation of twitch streams reacting to receiving thousands of dollars. Just so you know every donation in this video ...",2015-07-13 10:00:01,"youtube#video",452,219772,2223,267,"2025-04-28 00:03:09.151500+00:00"
"609","eBklqeeIu10","I Hate Spam On Youtube","This is just a little rant about spam and then I talk about some new things going on with this channel! Let me know if you like my ...",2015-07-12 19:08:52,"youtube#video",189,56377,1916,565,"2025-04-28 00:03:09.151500+00:00"
"610","SgMydsOucFg","INSANE TRIPLE LEGENDARY SUPPLY DROP! BEST OPENING YET?","This is the best triple legendary supply drop opening on youtube and if we could hit 1,0000,000,000000,000 likes I would be so ...",2015-07-11 20:08:50,"youtube#video",209,44229,NA,282,"2023-08-27 00:12:06.324381+00:00"
"611","jPm3hRiMKuU","Low Bridge Causes Dozen&#39;s Of Wrecks! 11-8 Bridge","Watching these clips of cars smashing into this low 11-8 brige is just hilarious. 11-8 Bridge webstie - http://11foot8.com/ ▻ Follow ...",2015-07-10 21:56:20,"youtube#video",223,42745,1769,460,"2024-01-02 00:13:54.170589+00:00"
"612","OweuuinkVZI","3k HYPE","FOLLOW MY TWITTER NOW! https://twitter.com/YTBeastYT.",2015-07-10 18:05:46,"youtube#video",203,142630,4303,680,"2024-09-19 00:03:00.262763+00:00"
"613","7Pr0HP-Trgk","How To Become A Gaming Youtuber! All You Need To Know!","In this video I talk about everything you need to know to kick off your gaming channel.",2015-07-08 22:00:01,"youtube#video",422,56375,2020,432,"2025-04-28 00:03:09.151500+00:00"
"614","UEK0fYAqMss","My Solution For The Theft At The FaZe House - @FaZe_Rain @FaZeAdapt","This is just a video where I talk about a recent problem in the FaZe house. Let me know what you think! ▻ Follow my twitter for ...",2015-07-08 10:00:00,"youtube#video",187,56375,1299,234,"2025-04-28 00:03:09.151500+00:00"
"615","lRznKN2oPUc","5 Popular Channels That Were Terminated","In this video I talk about some once big channels and how they got terminated from youtube. ▻ Follow my twitter for good luck!",2015-07-07 22:00:00,"youtube#video",300,136646,4521,1003,"2025-04-28 00:03:09.151500+00:00"
"616","IDrS_TrjuK4","What Is Youtube Terms Of Service?????","Ever wonder why a video of your was randomly taken down? Well in this I describe some of the possible reasons for that.",2015-07-07 10:00:00,"youtube#video",249,56704,1345,251,"2025-04-28 00:03:09.151500+00:00"
"617","J1lhxfZtR3M","Do You Think You Will Be Famous?????","We all upload daily and are on the grind. But is your content actually good enough that a million people would want to watch it?",2015-07-06 22:00:01,"youtube#video",224,140195,3128,604,"2025-02-02 00:06:39.407045+00:00"
"618","b_o8cz0ZNdk","What Is Swatting? Why I hate It!","In this video I talk about swatting and why I hate it. ▻ Subscribe? - http://bit.ly/1sBQXmi ▻ Please follow my twitter!",2015-07-05 18:08:37,"youtube#video",259,95559,2416,240,"2025-04-28 00:03:09.151500+00:00"
"619","i5dhcAxO25Q","Reddit Is In Chaos After Firing Victoria","The article - http://gawker.com/reddit-in-chaos-after-allegedly-firing-ama-coordinator-1715556970 My other upload of the day ...",2015-07-03 20:11:21,"youtube#video",106,55477,1081,171,"2024-12-14 00:10:32.723971+00:00"
"620","-o_8CDbFMJ0","Paid Promotion On Youtube Good?","Sorry about how my thoughts were everywhere in the commentary, I will probably start scripting them again, so they will be shorter ...",2015-07-03 19:26:09,"youtube#video",439,57404,1179,165,"2025-04-28 00:03:09.151500+00:00"
"621","v5J1Cycn3s8","How To Gain Youtube Success","In this video I will tell you how to become the next pewdiepie. ▻ Subscribe? - http://bit.ly/1sBQXmi ▻ Please follow my twitter!",2015-07-02 17:10:49,"youtube#video",162,86850,3047,312,"2025-04-28 00:03:09.151500+00:00"
"622","YJiqYG-Mylk","FaZe Members Reaction&#39;s To Joining Faze","This is a compilation of FaZe member's reacting to joining FaZe. I thought this was a good idea, let me know what you think!",2015-07-01 19:56:45,"youtube#video",191,561383,13191,689,"2023-08-27 00:12:06.324381+00:00"
"623","jGE1sUTeR5g","Battle of The Beasts Round 2 Winners!","If you won please skip to the end to see what your topic is for next round. Commentator - https://www.youtube.com/user/FlipArtz ...",2015-07-01 04:02:27,"youtube#video",847,50376,1343,353,"2024-07-27 00:06:31.073589+00:00"
"624","0tZCQ25fsoI","Youtube In 10 Years?????","What will youtube be like in 10 years? ▻ Subscribe? - http://bit.ly/1sBQXmi ▻ Please follow my twitter! - http://bit.ly/1ljKsl1 I read ...",2015-06-30 16:31:29,"youtube#video",186,218288,5680,1769,"2025-04-28 00:03:09.151500+00:00"
"625","N9jTogPwqVY","The Ultimate Motivation For Small Youtubers","This goes out to all the youtubers who don't seem to be growing, who are thinking about quiting, who feel like they are wasting ...",2015-06-29 17:27:21,"youtube#video",164,300919,15796,1947,"2025-04-13 00:04:39.670563+00:00"
"626","yyJ7xEcENNI","How Much Does Pewdiepie Make?","Ever wonder how much money pewdiepie makes off of youtube? Well in this video I am going to talk about pewdiepie's earnings.",2015-06-28 22:41:05,"youtube#video",233,243734,3139,219,"2025-04-28 00:03:09.151500+00:00"
"627","3rJgCGMPEqA","Random Stuff You Don&#39;t Care About","Me telling you about my life, Idk why you are watching it. ▻ Subscribe? - http://bit.ly/1sBQXmi ▻ Follow? - http://bit.ly/1ljKsl1 I read ...",2015-06-27 23:32:54,"youtube#video",142,52565,1984,446,"2024-09-19 00:03:00.262763+00:00"
"628","7isfkomGg7o","Battle Of The Beast Round 1 Winners!","ATTENTION! For round two your commentary must be about cake. I talk about it at the end of the video!",2015-06-23 19:49:57,"youtube#video",553,50059,1371,269,"2024-07-16 00:05:55.269382+00:00"
"629","UCYefSGBP00","The Truth About Big Community Channels","Ever tried to get your video up on a big community channel? Find out what to expect from it. ▻ Subscribe? - http://bit.ly/1sBQXmi ...",2015-06-22 16:32:02,"youtube#video",273,56080,2055,810,"2025-04-14 00:09:50.838112+00:00"
"630","dvdGkRK5a_0","WORLD&#39;S FIRST BLACK OPS 3 GUN SYNC!!","Look at this - http://gyazo.com/e0a0366e6944ebb5d556001b4ec23444 THIS IS THE FIRST BO3 GUN SYNC EVER! ▻ Subscribe ...",2015-06-22 01:19:49,"youtube#video",81,68279,1629,155,"2025-03-15 00:02:33.960815+00:00"
"631","X7doE4h6W64","Insane Gun Sync - 7 Hours To Make","Look at this - http://gyazo.com/8852509d2350db03af8ac1afa9172102 I probably should have done something easier for my first ...",2015-06-21 12:22:34,"youtube#video",134,51460,1999,430,"2024-09-19 00:03:00.262763+00:00"
"632","GhppzOzN3MM","Battle of The Beasts Bracket!!!! (Not accepting anymore)","Song - https://www.youtube.com/watch?v=aMPr67Z24j8 ▻ Subscribe? - http://bit.ly/1sBQXmi ▻ Follow? - http://bit.ly/1ljKsl1 I read ...",2015-06-20 03:32:30,"youtube#video",98,48149,1302,316,"2024-06-10 00:12:54.714011+00:00"
"633","QkXDatNdL4U","Free To Use Advanced Warfare Gameplay! 2015","Free to use gameplay - https://www.youtube.com/channel/UCmaAtMHgspY0au0NR5oz8PA ▻ Subscribe? - http://bit.ly/1sBQXmi ...",2015-06-19 14:07:22,"youtube#video",125,56383,1628,344,"2025-04-28 00:03:09.151500+00:00"
"634","hyt2t4r8lQ4","Battle Of The Beast Tournament UPDATE!","Apply - https://docs.google.com/forms/d/1GHkj1T6pLiGW4scsHYK_AZG73rxe9olQPcss7V9m864/viewform?usp=send_form IF ...",2015-06-18 23:25:47,"youtube#video",152,54754,1833,648,"2025-02-02 00:06:39.407045+00:00"
"635","-mlok5iT3GE","My Top 5 Favorite Things At E3 2015","This is a video and you are watching it. ▻ Subscribe? - http://bit.ly/1sBQXmi ▻ Follow? - http://bit.ly/1ljKsl1 I read every comment, ...",2015-06-18 17:18:38,"youtube#video",150,50780,1601,447,"2024-08-04 00:10:24.564597+00:00"
"636","STvOHHgJ1sQ","Battle Of The Beasts (youtubers needed)","Apply - https://docs.google.com/forms/d/1GHkj1T6pLiGW4scsHYK_AZG73rxe9olQPcss7V9m864/viewform?usp=send_form It ...",2015-06-17 20:58:19,"youtube#video",183,56454,1479,339,"2025-04-28 00:03:09.151500+00:00"
"637","2-ErX5oDzwM","History Of COD Part 2! Black Ops 1 - History Of COD On Youtube!","I made a video on how Cod started on youtube, and you guys demanded a part 2. So here ya go! Let me know if you want a part 3 ...",2015-06-13 21:34:28,"youtube#video",649,56282,1289,172,"2025-04-13 00:04:39.670563+00:00"
"638","7ytYV-tVIvg","How Did Notch Become A Billionaire? How Much Did Minecraft Sell For?????","Ever wonder how notch became a billionaire and how much he sold minecraft for? Well that is what this video is for! ▻ Subscribe?",2015-06-12 17:47:14,"youtube#video",216,111110,2667,221,"2025-02-03 00:01:40.008642+00:00"
"639","ELIoOUKSOJQ","Top 10 Richest Gaming Youtubers?????","Ever wonder how much money the top 10 gaming youtubers are making? Well here ya go. 1.) Pewdiepie - 261 million views ...",2015-06-11 16:42:11,"youtube#video",245,169128,5553,404,"2023-11-21 00:13:51.362600+00:00"
"640","uAoayezOaug","Markiplier Is A Great Man! Sub shodleech!","Someone had one wish and it was to start a channel called shodleech and Mark made that wish come true. Patrick/shodleech ...",2015-06-09 02:56:28,"youtube#video",123,170938,1987,152,"2024-05-16 00:07:10.924079+00:00"
"641","Vr2337tCLCI","Insane Advanced Warfare Hacker!","I decided to play infected on advanced warfare and I ran into a guy doing some type of glitching/hacking, idk what he did.",2015-06-07 22:58:31,"youtube#video",134,55877,1794,335,"2025-04-01 00:08:46.312747+00:00"
"642","NV7qmqbS8tM","What Is Considered A &quot;Bad Video&quot; On Youtube????? #karnageRC","People have different ideas on what they considered a good video and what they say is a bad one. In this video I give you my ...",2015-06-07 21:38:42,"youtube#video",252,71841,1491,162,"2025-04-28 00:03:09.151500+00:00"
"643","U9c-ycvw02A","I Think I Am Going For The #KarnageRC","In the video I just let you guys know what I am thinking ▻ Subscribe? - http://bit.ly/1sBQXmi ▻ Follow? - http://bit.ly/1ljKsl1 ...",2015-06-05 15:21:50,"youtube#video",232,56344,1882,501,"2025-04-27 00:02:44.651322+00:00"
"644","GfgcVOuHLAo","Every FaZe Video Ever #karnageRC","The title says it all ▻ Subscribe? - http://bit.ly/1sBQXmi ▻ Follow? - http://bit.ly/1ljKsl1 Sponsor - https://www.gofizzer.com USE ...",2015-06-04 19:09:17,"youtube#video",197,39782,1280,174,"2023-10-24 00:10:57.951335+00:00"
"645","zi7tZ-2PhLk","How Much Money Do You Make As An Uber Driver??????","In this video I talk about being an uber driver and give my thoughts and analysis on the whole thing on the money you make per ...",2015-05-31 18:31:25,"youtube#video",304,56367,1328,190,"2025-04-28 00:03:09.151500+00:00"
"646","TacjQmKCiZg","How Much Does Faze Rain&#39;s Giveaway Cost??????","In this video I show you how much money Faze Rain spent on his giveaway. ▻ Subscribe? - http://bit.ly/1sBQXmi ▻ Follow?",2015-05-30 21:27:08,"youtube#video",73,52999,1458,344,"2024-11-06 00:07:02.321174+00:00"
"647","AIytwdufwW8","MY MESSAGE TO COD YOUTUBERS (Watch till end plz)","The beginning of the video is a little off topic but I bring it all back in the finally minutes of the video. ▻ Subscribe?",2015-05-29 20:07:48,"youtube#video",292,56403,1436,251,"2025-04-28 00:03:09.151500+00:00"
"648","KLAI0c0Spog","Best Of FlipArtz - His Best Advanced Supply Drops EVER!","FlipArtz's is a really cool guy, and I saw some comments on his advanced supply drop videos, asking for a compilation of his best ...",2015-05-29 17:06:25,"youtube#video",640,88441,1175,119,"2024-06-02 00:09:21.609238+00:00"
"649","UVin8WtE5eU","Summer Is Finally Here!","This is a video with lots of words... ▻ Subscribe? - http://bit.ly/1sBQXmi ▻ Follow? - http://bit.ly/1ljKsl1 Sponsor ...",2015-05-28 21:46:37,"youtube#video",146,53019,1131,252,"2024-10-01 00:10:12.311967+00:00"
"650","wNuxirsrwBk","Why Are Things Unbalanced In Video Games?????","This is a video I uploaded to my other channel that I also wanted to re upload here! I hope you like it! ▻ Subscribe?",2015-05-28 20:36:06,"youtube#video",210,67874,1108,161,"2024-04-26 00:07:03.359831+00:00"
"651","6bxZpS0cm5o","New Channel?","Wtog - https://www.youtube.com/user/WeTalkOverGames The videos currently on this channel are old and when we start ...",2015-05-23 22:59:21,"youtube#video",291,158456,4143,405,"2025-04-13 00:04:39.670563+00:00"
"652","ajJbMGq9AS4","Youtube &quot;Freinds&quot;","I missed spelled ""Friends"" in the title just to piss you off :0 ▻ Subscribe? - http://bit.ly/1sBQXmi ▻ Follow? - http://bit.ly/1ljKsl1 ...",2015-05-23 01:28:10,"youtube#video",279,86545,1447,206,"2024-09-19 00:03:00.262763+00:00"
"653","UXw9jqgJNNc","Youtube Stat News - Vevo Gets 10 Bil. Views A Month, Channel Milestones, and more!","Skip to 1:20 to ignore my pointless rambling. Like I said in the video, this is just a test and the news videos will improve over time.",2015-05-21 00:31:22,"youtube#video",328,56369,2341,778,"2025-04-28 00:03:09.151500+00:00"
"654","E3CqKvlzl-I","Big Changes??? Idk just watch the stupid video","Not in the mood to make a thumbnail ▻ Subscribe? - http://bit.ly/1sBQXmi ▻ Follow? - http://bit.ly/1ljKsl1 Sponsor ...",2015-05-18 21:29:43,"youtube#video",394,55964,1761,386,"2025-04-05 00:04:52.614363+00:00"
"655","zfDr05ax0gM","How Much Money Does DramaAlert Make????","In this video I talk about how much money dramaAlert makes off of youtube. I personally love dramaAlert and that is why I decided ...",2015-05-15 23:53:16,"youtube#video",92,51126,1726,383,"2024-08-07 00:06:18.503858+00:00"
"656","56OkH6ocYZU","L0114R - Biblical Creeper Post for Post @L0114R","His channel - https://www.youtube.com/user/thefunky31 My vid on his channel - https://www.youtube.com/watch?v=tGmtv6QM1rQ ...",2015-05-15 16:48:54,"youtube#video",88,51497,1116,237,"2024-09-19 00:03:00.262763+00:00"
"657","w40Z8aT5fpQ","Why Do We Do Things That Are Bad For Us?????","This is a video where I talk, and now your watching it. ▻ Subscribe? - http://bit.ly/1sBQXmi ▻ Follow? - http://bit.ly/1ljKsl1 Sponsor ...",2015-05-14 23:52:57,"youtube#video",204,56419,1803,266,"2025-04-28 00:03:09.151500+00:00"
"658","zgDezsMQyyU","How To Monetize Your Videos And Make Lots Of Youtube Money!!$$$","I spent hours looking all this info up, if you see something that is not true in this video please let me know and I will put up an ...",2015-05-10 20:59:50,"youtube#video",623,53372,1535,321,"2024-12-14 00:10:32.723971+00:00"
"659","__SaaKSW9iE","Cut Coms vs Uncut Coms","For all you youtubers out there ▻ Subscribe? - http://bit.ly/1sBQXmi ▻ Follow? - http://bit.ly/1ljKsl1 Sponsor ...",2015-05-09 06:53:13,"youtube#video",159,55567,1493,311,"2025-03-15 00:02:33.960815+00:00"
"660","qWnyJ55KBKo","Minimum Wage","Hey, that beast guy uploaded again 0.o ▻ Subscribe? - http://bit.ly/1sBQXmi ▻ Follow? - http://bit.ly/1ljKsl1 Sponsor ...",2015-05-07 23:27:32,"youtube#video",119,73603,1658,170,"2025-04-28 00:03:09.151500+00:00"
"661","52awie9G00A","My New Channel Trailer ;)","Yeah, umm I have no idea what to write ▻ Subscribe? - http://bit.ly/1sBQXmi ▻ Follow? - http://bit.ly/1ljKsl1 Sponsor ...",2015-05-07 01:27:48,"youtube#video",77,62036,1657,141,"2025-04-09 00:04:24.705721+00:00"
"662","bB99NdUoxEQ","Why I Changed My Channel Name","Subscribe? - http://bit.ly/1sBQXmi ▻ Follow? - http://bit.ly/1ljKsl1 Sponsor - https://www.gofizzer.com USE CODE BEAST FOR A ...",2015-05-03 23:59:54,"youtube#video",196,141720,3639,343,"2025-04-14 00:09:50.838112+00:00"
"663","7GjSaNi8Epg","How Overpriced Is Movie Popcorn?????","Idk why that chick in the new Avengers likes hulk. She could do better. ▻ Subscribe? - http://bit.ly/1sBQXmi ▻ Follow?",2015-05-03 18:39:15,"youtube#video",160,48892,1364,301,"2024-07-12 00:10:42.102144+00:00"
"664","h5uE4ERMiTk","Screw Warface","We have conquered the gameplay on this channel ▻ Subscribe? - http://bit.ly/1sBQXmi ▻ Follow? - http://bit.ly/1ljKsl1 Sponsor ...",2015-05-02 21:41:18,"youtube#video",217,56213,1498,244,"2025-04-15 00:00:59.391066+00:00"
"665","umRLkCrmwcs","My Problems","This is an old game of Black ops 2. I am trying to get xbox live and record some more bo2. Please tell me if you like it better than ...",2015-05-01 02:23:50,"youtube#video",247,72804,2024,235,"2025-04-28 00:03:09.151500+00:00"
"666","rHoLyltYDtQ","Ma Channel","I am currently eating chicken, its a little cold which makes me very sad :( ▻ Subscribe? - http://bit.ly/1sBQXmi ▻ Follow?",2015-04-29 23:50:00,"youtube#video",168,42544,1307,246,"2023-12-30 00:07:46.900726+00:00"
"667","yeHjsYQ076A","Remember When COD Was Fun?","Yup, another very pointless video ▻ Subscribe? - http://bit.ly/1sBQXmi ▻ Follow? - http://bit.ly/1ljKsl1 Sponsor ...",2015-04-26 21:26:36,"youtube#video",216,56406,1690,321,"2025-04-28 00:03:09.151500+00:00"
"668","ywZy_Fo2ydo","Modern Art Is A Joke","Insert cleverly worded description here. ▻ Subscribe? - http://bit.ly/1sBQXmi ▻ Follow? - http://bit.ly/1ljKsl1 Sponsor ...",2015-04-25 15:02:30,"youtube#video",169,36613,1001,161,"2023-08-27 00:12:06.324381+00:00"
"669","qr4v9pdfVlU","Cheat Channels","These are the youtube channels I hate ▻ Subscribe? - http://bit.ly/1sBQXmi ▻ Follow? - http://bit.ly/1ljKsl1 Sponsor ...",2015-04-24 01:53:38,"youtube#video",214,55217,1630,362,"2025-02-25 00:01:23.965206+00:00"
"670","hgiPX33AHas","Time","I guess I should describe the video here. ▻ Subscribe? - http://bit.ly/1sBQXmi ▻ Follow? - http://bit.ly/1ljKsl1 Sponsor ...",2015-04-22 21:33:54,"youtube#video",114,81483,1688,156,"2025-01-04 00:03:39.835883+00:00"
"671","oZ-Mn5p1xMw","2,000 Subscribers","Thanks for subscribing, here is a really dumb video. ▻ Subscribe? - http://bit.ly/1sBQXmi ▻ Follow? - http://bit.ly/1ljKsl1 Sponsor ...",2015-04-18 18:45:34,"youtube#video",145,297434,12145,2813,"2025-04-15 00:00:59.391066+00:00"
"672","5UPa_hu5opg","Youtube","This is a video where I talk over a game, Yay I am super original. ▻ Subscribe? - http://bit.ly/1sBQXmi ▻ Follow?",2015-04-14 22:39:24,"youtube#video",277,86396,2118,227,"2024-09-19 00:03:00.262763+00:00"
"673","zv_oq5UNDAo","How To SAT, Get Into Yale","These test taking skills will give you a score so high that you will be able to get into any college of your choice. ▻ Subscribe?",2015-04-13 11:08:02,"youtube#video",245,46367,1086,180,"2024-05-08 00:10:49.880176+00:00"
"674","NiqkH7qVW0U","100k Subs With No Videos????","I have lost my faith in humanity The channel ...",2015-04-11 16:51:40,"youtube#video",257,478485,9480,2823,"2025-04-28 00:03:09.151500+00:00"
"675","boBokLXe5o8","Is Jacksepticeye A Millionaire?????? 2016","I wish poods would give me a shout out ▻ Subscribe? - http://bit.ly/1sBQXmi ▻ Follow? - http://bit.ly/1ljKsl1 Sponsor ...",2015-04-09 23:07:38,"youtube#video",190,191950,3274,666,"2024-09-19 00:03:00.262763+00:00"
"676","7YOzgk-U4EU","How Rich Is Buzz Feed???","Ever wonder how much money Buzz Feed makes? Here ya go! ▻ Subscribe? - http://bit.ly/1sBQXmi ▻ Follow?",2015-04-07 11:16:50,"youtube#video",205,46653,846,184,"2023-12-11 00:06:37.374405+00:00"
"677","prdSftLj9-g","How To Do A High School or College Paper!","Subscribe? - http://bit.ly/1sBQXmi ▻ Follow? - http://bit.ly/1ljKsl1 I read every comment, and love any type of feedback you leave ...",2015-04-06 11:42:14,"youtube#video",236,93770,1787,187,"2025-04-28 00:03:09.151500+00:00"
"678","pzlPJmNyepA","What is Crohn&#39;s Disease?????","Ummm, Idk what I am supposed to write here xD Enjoy the video. ▻ Subscribe? - http://bit.ly/1sBQXmi ▻ Follow?",2015-04-04 20:31:25,"youtube#video",423,518542,18154,1202,"2025-04-27 00:02:44.651322+00:00"
"679","QNoqAnJOSqU","What Happens If You Get A Copy Right Strike??","Phew ▻ Subscribe? - http://bit.ly/1sBQXmi ▻ Follow? - http://bit.ly/1ljKsl1 I read every comment, and love any type of feedback ...",2015-04-03 19:45:11,"youtube#video",232,169714,4380,539,"2024-09-19 00:03:00.262763+00:00"
"680","kzIA4vKyhRQ","5 Steps To Becoming Successful On Youtube","This is a super in-depth video on how to become famous :) ▻ Subscribe? - http://bit.ly/1sBQXmi ▻ Follow? - http://bit.ly/1ljKsl1 I ...",2015-04-02 23:10:02,"youtube#video",193,173484,7893,682,"2025-04-15 00:00:59.391066+00:00"
"681","DfonKqMENrg","Making Youtube a Priority","Just so the title does not mix you up, I am not putting youtube before - socializing, school, or sports, But I am prioritizing my time ...",2015-04-01 23:58:35,"youtube#video",196,54432,1509,212,"2024-07-13 00:05:53.740664+00:00"
"682","MUQCwdkEbq0","Why I Was Not Uploading","Some might find this video pointless, but I think it will help some people out there who run their own channel. ▻ Subscribe?",2015-03-21 22:11:51,"youtube#video",95,40305,955,167,"2023-10-08 00:13:03.856277+00:00"
"683","0VjLq-go1fg","How Much $$$ Does Every Member of FaZe Make COMBINED????? 2016","These are the views for every member of Faze from last month. Faze clan - 5000000 FaZe Temperrr - 500000 FaZe CBass ...",2015-03-05 02:07:01,"youtube#video",237,106777,1689,335,"2025-04-28 00:03:09.151500+00:00"
"684","uCIpW9zOmgI","Is Pewdiepie The #2 Youtuber?!?!?  :0","Did you know that a girl who reviews random Disney princess actually gets more views than the great and almighty pewds?",2015-03-04 01:53:50,"youtube#video",235,89074,1768,318,"2025-04-28 00:03:09.151500+00:00"
"685","Z0Poefgrs4w","How Much Money Does Smosh Make????? 2016","Ever wonder how much this big youtuber makes? Well here ya go, hope you enjoy! ▻ Subscribe? - http://bit.ly/1sBQXmi ▻ Follow ...",2015-03-03 01:14:27,"youtube#video",167,74118,1346,213,"2025-04-08 00:08:53.637499+00:00"
"686","MLN6TRB9Jxw","Who Are The Worst Youtubers?????","Have you ever wondered who did the worst last month on youtube? Good! Here is the answer :) Stats ...",2015-03-01 12:00:00,"youtube#video",216,258711,4152,400,"2025-04-28 00:03:09.151500+00:00"
"687","vZrL_FFITgs","Subscriber Goals For 2016","I thought this was really cool, make sure to leave a comment if you want to be in next year's video! ▻ Subscribe?",2015-02-28 17:12:07,"youtube#video",248,56885,1512,562,"2025-04-26 00:02:13.435310+00:00"
"688","L7lGD_anC00","How Many People Do Youtube as a JOB?????","I was just randomly thinking one day, and this idea popped into my head. So I decided to do the math and share with you guys ...",2015-02-26 02:07:13,"youtube#video",174,56838,1474,230,"2025-04-17 00:03:00.167840+00:00"
"689","xu1nhAfnMGA","How Much Money Does Syndicate Project Make????? 2016","This has been highly requested and here you go! ▻ Subscribe? - http://bit.ly/1sBQXmi ▻ Follow? - http://bit.ly/1ljKsl1 I read every ...",2015-02-24 20:26:12,"youtube#video",203,85122,1187,243,"2025-04-28 00:03:09.151500+00:00"
"690","D1livXdFGkQ","Are Youtubers Millionaires?","Are your favorite youtubers who get billions of views ""millionaires"" Find out now! ▻ Subscribe? - http://bit.ly/1sBQXmi ▻ Follow?",2015-02-22 19:45:00,"youtube#video",195,187052,3356,401,"2025-04-28 00:03:09.151500+00:00"
"691","bwp_3qLgWpQ","Magecraft - Epic Hit! 11k Troops killed.","This is an app that I love to play in my free time. ▻ Subscribe? - http://bit.ly/1sBQXmi ▻ Follow? - http://bit.ly/1ljKsl1 I read every ...",2015-02-21 15:41:14,"youtube#video",233,51451,1339,317,"2024-09-19 00:03:00.262763+00:00"
"692","tZpnfF0-7Ls","Highest Paid Musicians????","This are the singers who made the most money last year. No surprise to me that they are pulling in so much dough. ▻ Subscribe?",2015-02-17 21:38:06,"youtube#video",288,116558,1892,272,"2024-09-15 00:06:36.648338+00:00"
"693","BwAMltY3-c0","Making Fun Of Youtuber&#39;s Intros.","I got bored and decided to bash on other people lol ▻ Subscribe? - http://bit.ly/1sBQXmi ▻ Follow? - http://bit.ly/1ljKsl1 I read ...",2015-02-16 19:45:42,"youtube#video",114,297792,7266,619,"2023-08-28 00:07:09.494141+00:00"
"694","7HBR3Ea72CY","10 Things You DIDN&#39;T Know About Youtube!","These are all interesting to me and I thought I would share them with you. Most of the Information mentioned in this video was ...",2015-02-08 00:04:06,"youtube#video",181,71311,1621,166,"2025-04-11 00:01:43.706665+00:00"
"695","Ds9H2UnUHL0","Quitting?","I say everything in the video, I really feel motivated to upload again but I dont want to do like I always have and upload 5 videos ...",2015-02-06 22:27:38,"youtube#video",226,131728,4712,638,"2025-02-02 00:06:39.407045+00:00"
"696","iqUFeWAVp-0","How Much Money Does Markiplier Make????? 2016","I talk about how much he makes. ▻ Subscribe? - http://bit.ly/1sBQXmi ▻ Follow? - http://bit.ly/1ljKsl1 I read every comment, and ...",2015-01-04 20:59:46,"youtube#video",154,136835,2214,235,"2025-04-28 00:03:09.151500+00:00"
"697","W2skFWRk6qo","PewDiePie Uploads A Fake Video! LOL","Someone stole a animation and then sent it into Pewds, who actually uploaded it and gave credit to someone who stole an ...",2015-01-01 18:56:04,"youtube#video",155,82699,1595,205,"2025-04-28 00:03:09.151500+00:00"
"698","X_qd-1xSTFA","Pewdiepie Was On T.V.","I wonder if I will ever be on t.v. ▻ Subscribe? - http://bit.ly/1sBQXmi ▻ Follow? - http://bit.ly/1ljKsl1 I read every comment, and love ...",2014-12-07 17:51:08,"youtube#video",149,142738,3350,403,"2024-09-19 00:03:00.262763+00:00"
