"","id","title","description","publishTime","kind_stats","duration_seconds","viewCount","likeCount","commentCount","pull_date"
"414","0SNiEDWRnEQ","Counting To 300,000 Road To A Mil (Part 1)","I will do the other half later, thanks for watching Follow my twitter incase the stream goes offline - https://twitter.com/MrBeastYT ...",2017-04-02 11:22:45,"youtube#video",40287,2859961,55712,3262,"2022-11-02 00:30:24.678552+00:00"
"415","igVcy5dtN80","Grilling A Microwave Microwaving A Microwave Microwaving A Toaster Toasting An Iphone Watching Micro","Grilling A Microwave Microwaving A Microwave Microwaving A Toaster Toasting An Iphone Watching Microwaving a Microwave ...",2017-03-30 22:10:41,"youtube#video",188,2118204,72160,4973,"2025-04-13 00:04:39.670563+00:00"
"416","o6tDuwd5gzE","Dropping 10,000 Pennies In Public Prank","I CAN'T BELIEVE WE DID THIS LIKE HOLY CRAP Enter $500 Giftcard Giveaway: http://bit.ly/2nVhJgm SUBSCRIBE FOR A FREE ...",2017-03-28 21:05:04,"youtube#video",109,4689314,140410,9468,"2022-08-09 00:21:29.422324+00:00"
"417","dEOlvTqYUNo","#1 MOST INSANE MAGNET LIFE HACK EVER","THIS IS CRAZY SUBSCRIBE FOR A FREE CAR NEW Merch Store! - https://mrbeast.store Check out Viewstats!",2017-03-24 21:40:17,"youtube#video",309,26285957,523559,18025,"2025-04-28 00:03:09.151500+00:00"
"418","AS5CxLCWq-Q","Watching Dance Till You&#39;re Dead For 10 Hours","I WATCHED THE WHOLE VIDEO Enter $500 Giveaway - bit.ly/2nVhJgm SUBSCRIBE FOR A COOKIE NEW Merch Store!",2017-03-21 22:40:12,"youtube#video",36001,54563998,2625368,NA,"2025-04-28 00:03:09.151500+00:00"
"419","jtOalDNVrKM","I Can&#39;t Break My Strange Addiction","I DON'T KNOW WHY I DO THIS Buy shirts - https://shop.crowdmade.com/collections/mrbeast SUBSCRIBE FOR A FREE CAR ...",2017-03-19 21:45:07,"youtube#video",285,1857631,94820,9148,"2023-12-12 00:14:29.153552+00:00"
"420","dDYP56hEYF0","OMG! INSANE CUP FORT","THIS CUP FORT IS CRAZY!!!! SUBSCRIBE FOR A FREE CAR ---------------------------------------------------------------- ▻ Follow all three ...",2017-03-14 22:40:01,"youtube#video",309,4090807,96607,9473,"2023-08-27 00:12:06.324381+00:00"
"421","pJSbLk-Iixc","Savage Level 9000","SCREW SOCIETY SUBSCRIBE FOR A FREE CAR INSPIRED BY THIS COMEDIAN PLZ SUB GO HIM ...",2017-03-08 23:10:06,"youtube#video",110,7333901,322957,15396,"2024-08-03 00:10:36.838351+00:00"
"422","rqUvnLPvbrM","Reacting To The Reaction Of The Reaction To The Reaction Of The Reaction Of The Reaction To The Reac","To the reaction of the reaction to the reaction of the reaction to the reaction of the reaction to the reaction of the reaction to the ...",2017-02-22 00:00:04,"youtube#video",2009,7665314,325031,25729,"2024-04-02 00:12:57.200817+00:00"
"423","9CVwXBYVqVk","Counting To 200,000 (Road To A Mil)","I can't believe I did this *expand* Like I said at the beginning of the video, I didn't want to speed this up but I had no choice.",2017-02-18 00:00:03,"youtube#video",84878,3999035,154044,19132,"2025-02-27 00:05:30.192453+00:00"
"424","i8pmk5xnO2s","Microwaving Dry Ice (Microwave Explodes)","I CAN'T BELIEVE THAT HAPPENED like for a cookie ---------------------------------------------------------------- ▻ Follow all three and ...",2017-02-09 22:29:35,"youtube#video",363,3317288,97158,6241,"2023-12-12 00:14:29.153552+00:00"
"425","xWcldHxHFpo","I Counted To 100,000!","I can't believe I did this.. Like or I eat your food NEW Merch Store! - https://mrbeast.store Check out Viewstats!",2017-01-09 00:00:39,"youtube#video",85687,31545722,1472635,128878,"2025-04-28 00:03:09.151500+00:00"
"426","YH1-fDzHHpo","we are number one but every one is a bad intro","we are number one but every one is replaced with a bad intro like or die https://www.gofundme.com/2tm9tqk If you can, please ...",2016-12-25,"youtube#video",221,1983284,56442,8274,"2025-04-15 00:00:59.391066+00:00"
"427","Qy17S3g8ZuY","HOW TO UNLOCK ANY IPHONE WITHOUT THE PASSCODE","I GOT IN!!! like or i date your mom In this video I talk about how to unlock your iphone without the passcode. NEW Merch Store!",2016-12-21 02:00:00,"youtube#video",531,23000666,579451,33002,"2025-04-08 00:08:53.637499+00:00"
"428","PJyWmlWNor8","WHY DO THEY SELL THIS ON AMAZON?","HOW DID IT DO THAT? like for a free package NEW Merch Store! - https://mrbeast.store Check out Viewstats!",2016-12-18 02:00:04,"youtube#video",511,8821597,719621,13068,"2025-04-13 00:04:39.670563+00:00"
"429","KzwTYZ2W3ZA","Microwaving A Microwave","IT BLEW UP WTF like or i steal yo girl NEW Merch Store! - https://mrbeast.store Check out Viewstats! - https://www.viewstats.com/ ...",2016-12-09 02:45:18,"youtube#video",545,11681151,437453,41253,"2025-04-13 00:04:39.670563+00:00"
"430","9fa_JYTPZ2Y","IF YOU ONLY SEE ORANGE YOU&#39;RE COLOR BLIND","I WISH I WAS COLOR BLIND NEW Merch Store! - https://mrbeast.store Check out Viewstats! - https://www.viewstats.com/ For any ...",2016-12-05 02:21:43,"youtube#video",233,1827276,93515,7621,"2025-01-13 00:03:05.026026+00:00"
"431","t1BWMa8btIw","I Mailed Myself IN A BOX &amp; it REALLY WORKED! (Human Mail Challenge)","WHAT IS WRONG WITH ME like or your computer will explode Rock - https://www.youtube.com/watch?v=KkS_sth28rs Paper ...",2016-11-30 02:31:18,"youtube#video",302,16423629,455185,15846,"2025-04-13 00:04:39.670563+00:00"
"432","2O8wta4FsD4","STUPIDEST PERSN ON EART (Really Dumb)","HOW IS HE SO STUPID? like or I eat your mom's dinner Rock - https://www.youtube.com/watch?v=KkS_sth28rs Paper ...",2016-11-28 00:01:52,"youtube#video",262,2526221,184571,12379,"2025-04-28 00:03:09.151500+00:00"
"433","dSDBr0WjrwQ","Reading The Entire Bee Movie Script But Everytime They Say &quot;Bee&quot; I Repeat All the Previous Bees","Every time I say bee I repeat the previous ones READING THE BEE MOVIE SCRIPT Rock ...",2016-11-25 01:43:37,"youtube#video",5459,10946448,217445,12443,"2024-08-01 00:09:18.063127+00:00"
"434","DbC9CauTXoM","THE WORST THINGS EVER TO EXIST","WHY IS THIS A THING like or your computer explodes (100% not fake) Rock - https://www.youtube.com/watch?v=lvIzF_clV1E ...",2016-11-19 00:40:47,"youtube#video",318,3751599,330318,18957,"2024-04-28 00:10:05.385765+00:00"
"435","yhNcDBnQsEY","BLOWING UP $1000 KEYBOARD *RIP WALLET*","THAT WAS EPIC OMG Like or I eat your pie Rock - https://www.youtube.com/watch?v=KkS_sth28rs Paper ...",2016-11-11 23:02:10,"youtube#video",300,3877169,227276,4915,"2025-04-13 00:04:39.670563+00:00"
"436","Wyyqz3OxB5c","MY $1000 KEYBOARD CHANGED MY LIFE","I DIDN'T KNOW IT DID THIS Like the video or the keyboard kills you Keyboard link ...",2016-11-03 21:32:53,"youtube#video",213,13426658,355954,7827,"2024-12-14 00:10:32.723971+00:00"
"437","KO8B2kw_Jxs","I BOUGHT A 1000$ KEYBOARD","THIS KEYBOARD IS INSANE Like or I will eat your dog food Rock - https://www.youtube.com/watch?v=lvIzF_clV1E Paper ...",2016-10-25 21:06:50,"youtube#video",381,1619049,38305,2796,"2025-04-15 00:00:59.391066+00:00"
"438","NEDPgQYhbqs","IF ONLINE ADS WERE REAL","Congrats you won 1000000$ Like or ads will eat you Rock - https://www.youtube.com/watch?v=KkS_sth28rs Paper ...",2016-10-16 20:30:00,"youtube#video",276,9886303,581454,17771,"2025-01-09 00:02:54.860557+00:00"
"439","DpIvW6av0pI","IT FINALLY CAME IN THE MAIL","SILVER PLAY BUTTON song used (comment I sent u) - https://www.youtube.com/watch?v=T_phH3ULSn4 Rock ...",2016-10-10 21:05:39,"youtube#video",303,345346,11762,1305,"2025-04-14 00:09:50.838112+00:00"
"440","jhYG5BStQSk","Hi Me In A Year (Scheduled Uploaded A Year Ago)","I hope you have 50k subs, you probably won't but it's worth a shot. Did I say you could open this?",2016-10-04 21:00:01,"youtube#video",119,1627104,53521,4728,"2024-08-09 00:08:05.585380+00:00"
"441","Fzh65vCyHWQ","24 HOUR EXPLOSION GIVEAWAY! WIN GIFTCARDS","LIKE TO INCREASE YOUR CHANCE OF FINDING SOMETHING Rock - https://www.youtube.com/watch?v=5I9EPjrzhW4 Paper ...",2016-09-05 22:31:58,"youtube#video",86402,787815,34405,4622,"2024-09-27 00:06:44.531781+00:00"
"442","vBp0bzVr09s","LISTENING TO OLD VOICEMAILS FOR THE FIRST TIME","Listening to really old voicemails for the first time! LIKE OR YOU WILL BE A VOICEMAIL Giveaway ...",2016-08-28 21:00:01,"youtube#video",313,372700,11589,1034,"2025-04-08 00:08:53.637499+00:00"
"443","dJCsc_Cq9i4","BEST WALMART TOILET PAPER FORT","Toilet paper fort in walmart is for mlg people like us Like or your computer will explode My friend's channel ...",2016-08-24 21:00:01,"youtube#video",256,1469364,51120,2993,"2025-01-08 00:07:11.030307+00:00"
"444","bqpKlkPpT10","100 LAYERS OF SARAN WRAP + TOILET PAPER!!","100 Layers of toilet paper and ceramic wrap! Like or I make you a layer Chris ...",2016-08-23 21:01:56,"youtube#video",463,3332740,139452,6773,"2025-04-15 00:00:59.391066+00:00"
"445","TIIU1ivhLKs","WORST REVIEWS ON AMAZON #4 *FUNNY*","Amazon reviews are funny af Like or I eat your pie Rock - https://www.youtube.com/watch?v=GCM0tJ6azks Paper ...",2016-08-21 21:17:07,"youtube#video",203,1656817,125245,3582,"2025-04-15 00:00:59.391066+00:00"
"446","G4qOiwIE_o0","HOW MUCH MONEY DO YOUTUBERS MAKE?","How much do youtubers make? idk how much does your mom eat? Like to get youtube money Rock ...",2016-08-14 20:20:03,"youtube#video",205,3139161,152641,5487,"2025-04-17 00:03:00.167840+00:00"
"447","yozl6enFC-w","THE WORST SONG ON YOUTUBE *CRINGE*","This is a song about bad teammates in COD Like or I will be Justin Bieber Rock - https://www.youtube.com/watch?v=d8tZk1IgyLU ...",2016-08-08 20:00:02,"youtube#video",248,839515,42223,6680,"2025-04-28 00:03:09.151500+00:00"
"448","LP_mGU3CgXk","SURPRISING MY BROTHER WITH A LAPTOP","HE THOUGHT IT WAS A PRANK WHY AM I TYPING IN ALL CAPS? idk tbh lol Rock - http://bit.ly/2aEQ3r4 Paper ...",2016-08-07 19:35:12,"youtube#video",176,1705853,116096,4070,"2025-04-15 00:00:59.391066+00:00"
"449","DoIQMkoYSzw","SELLING ORGANS FOR $1,000,000","Did you know your kidney is worth 200000$? lol Like or I will become your kidney.",2016-08-02 20:02:21,"youtube#video",335,3568426,122670,7668,"2023-12-01 00:12:02.032051+00:00"
"450","e-If_d_bzfI","POKEMON GO STEREOTYPES","Pokemon go has many people doing things and I like pie His Insta - https://www.instagram.com/tylerconklinbaseball/ Rock ...",2016-07-14 17:36:53,"youtube#video",207,2274613,64483,2597,"2025-04-13 00:04:39.670563+00:00"
"451","5J6-5g2alp8","100,000 SUBSCRIBERS.EXE","I never thought this many people would care about my stupid internet videos.",2016-07-08 20:00:00,"youtube#video",266,1440272,80380,7891,"2024-08-27 00:08:15.885955+00:00"
"452","qjGNBluF6_I","WORST REVIEWS ON AMAZON #2 HOW IS THIS LEGAL?","These reviews are for the worst product on amazon Gummy bears ...",2016-07-02 20:30:01,"youtube#video",290,1179711,46289,5182,"2023-12-11 00:06:37.374405+00:00"
"453","TLoDwqQF5ug","BLOWING UP MY TABLET","I will miss throwing you at things ;( Like or I blow up your computer Rock - https://www.youtube.com/watch?v=5I9EPjrzhW4 Paper ...",2016-07-01 20:30:01,"youtube#video",152,175374,7451,1255,"2025-01-05 00:04:16.500428+00:00"
"454","uAFGIQPWL54","Worst Reviews On Amazon #1 (Minecraft Edition)","Worst Reviews On Amazon #1 (Minecraft Edition) Tad download - http://givetad.com/MrBeast I will greatly appreciate any tads ...",2016-06-26 21:24:27,"youtube#video",256,702671,17118,1522,"2023-08-27 00:12:06.324381+00:00"
"455","SaDDjW9Rw-M","WORST THUMBNAILS ON YOUTUBE #3","Worst thumbnails in the history of thumbnails SUBMIT THUMBNAILS ...",2016-06-21 20:01:20,"youtube#video",184,876316,34576,1824,"2024-07-16 00:05:55.269382+00:00"
"456","CHdy9wND1jo","REACTING TO MY OLD MINECRAFT VIDEOS (HORRIBLE)","MrBeast reacts to his terrible minecraft videos. Rock - https://www.youtube.com/watch?v=d8tZk1IgyLU Paper ...",2016-06-19 20:36:36,"youtube#video",523,1342924,35874,2747,"2025-04-28 00:03:09.151500+00:00"
"457","9LiS_3HEErU","HOW TO MAKE A GOOD INTRO FOR YOUTUBE","Follow this to never get on worst intros :) Like or your computer will explode Idea from - https://www.facebook.com/BroScienceLife ...",2016-06-14 20:51:19,"youtube#video",184,185345,6093,1361,"2025-04-13 00:04:39.670563+00:00"
"458","hRj5qNfkdO0","WORST BANNERS ON YOUTUBE #1","Worst banners on youtube aka minecraft banners Submit here ...",2016-06-13 21:13:33,"youtube#video",216,673545,18878,3622,"2025-04-09 00:04:24.705721+00:00"
"459","ocruJKe2tFk","50,000 Subscribers.exe","Watch out pewdiepie Open for the goods Banner submission ...",2016-06-11 21:01:16,"youtube#video",215,487663,20448,3361,"2024-07-22 00:07:29.410474+00:00"
"460","MgRMNzKknto","Dude Perfect 4.0 - We Are Totally Better","Dude Perfect 4.0 - We Are Totally Better Like or we will make more. Rock - https://www.youtube.com/watch?v=GCM0tJ6azks ...",2016-06-06 21:01:41,"youtube#video",213,431043,13045,1772,"2025-04-21 00:04:50.186384+00:00"
"461","tqO3_AKC5Ks","CUTTING TABLE IN HALF WITH PLASTIC KNIVES","SONG (tell him I sent you) - https://twitter.com/IvanBnw Song name is sweaters.",2016-06-04 20:31:28,"youtube#video",245,3733957,165482,6864,"2025-04-13 00:04:39.670563+00:00"
"462","XW1TsAVdXsw","BEST INTROS ON YOUTUBE #1","BEST INTROS ON YOUTUBE #1 Rock - https://www.youtube.com/watch?v=5I9EPjrzhW4 Paper ...",2016-06-01 20:42:11,"youtube#video",185,28454504,817633,27424,"2025-04-26 00:02:13.435310+00:00"
"463","Qhdj_Umh1IE","Motivation For Youtubers #6 LAST ONE","THIS IS MY LAST MOTIVATIONAL VIDEO AND YES I HAVE USED SOME OF THESE CLIPS BEFORE. I wanted to end on a good ...",2016-05-24 15:00:01,"youtube#video",179,156346,6302,503,"2025-04-28 00:03:09.151500+00:00"
"464","fN_RQFqaGHI","How Many Licks Does It Take To Get To The Center Of A Tootsie Pop?","How Many Licks Does It Take To Get To The Center Of A Tootsie Pop? Rock - https://www.youtube.com/watch?v=5I9EPjrzhW4 ...",2016-05-19 21:00:01,"youtube#video",757,387113,12216,2501,"2025-04-09 00:04:24.705721+00:00"
"465","hC3xW8xeCDs","Motivation For Youtubers #5","I tried to make this one short and to the point. It is all based on what YOU do with your time. You can be a youtuber, it just takes ...",2016-05-15 21:00:01,"youtube#video",148,198305,8798,546,"2025-04-28 00:03:09.151500+00:00"
"466","lMLEcUXz6T8","Cereal Commentary","I rate cereal 6/10, totally using a different brand next time. NEW Merch Store! - https://mrbeast.store Check out Viewstats!",2016-04-28 00:36:58,"youtube#video",339,166016,5502,607,"2025-04-15 00:00:59.391066+00:00"
"467","BKJy7BFP3Is","WHERE IS MY COOKIE?????","Rock - https://www.youtube.com/watch?v=5I9EPjrzhW4 Paper - https://www.youtube.com/watch?v=GCM0tJ6azks Scissors ...",2016-04-24 21:31:29,"youtube#video",162,123152,12374,1200,"2025-04-11 00:01:43.706665+00:00"
"468","1gfgZhW3YgU","How Much Money Do Big Youtubers Make? (Pewdiepie, Markiplier, etc)","How Much Money Do Big Youtubers Make? (Pewdiepie, Markiplier, etc) Like the video or you will never make youtube money.",2016-04-22 21:02:56,"youtube#video",228,93428,3975,361,"2023-08-27 00:12:06.324381+00:00"
"469","VXmKt_1T0QM","Struggles Of Being A Youtuber","Struggles Of Being A Youtuber Like the video or your computer will explode Rock ...",2016-04-19 21:30:01,"youtube#video",194,115180,4663,1059,"2024-01-07 00:08:21.890590+00:00"
"470","ttWTSskmxTA","Life Before And After Gamma (Insane) @GFuelEnergy","Life Before And After Gamma (Insane) This video is not a sponsorship, we are just stupid :) Rock ...",2016-04-13 23:08:34,"youtube#video",161,50084,2039,617,"2024-07-19 00:09:23.657625+00:00"
"471","5bCyFf8lSfk","Worst Thumbnails On Youtube #2 - Cringe","Worst Thumbnails On Youtube #2 - Cringe →→ FOLLOW FOR GOOD LUCK→→ https://twitter.com/MrBeastYT These thumbnails ...",2016-04-10 22:00:00,"youtube#video",133,289073,10249,545,"2025-04-15 00:00:59.391066+00:00"
"472","ngVEpJs5A5s","Motivation For Small Youtubers #4 - Inspiration For Youtubers","Motivation For Small Youtubers #4 - Inspiration For Youtubers Never quit Rock ...",2016-04-08 00:11:29,"youtube#video",190,150345,7233,622,"2025-04-28 00:03:09.151500+00:00"
"473","zjC48c3ptt0","Scheduled Uploaded 6 Months Ago (REACTION)","Just call me jinx.",2016-04-06 21:02:02,"youtube#video",322,140931,5126,452,"2025-04-09 00:04:24.705721+00:00"
"474","rS2sntC-lJI","Dude Perfect 3.0 - We Are Better","Just refer to us as Dude Perfect from now on. Rock - https://www.youtube.com/watch?v=QULAG... Paper ...",2016-04-04 21:30:00,"youtube#video",193,686825,21258,1951,"2023-12-11 00:06:37.374405+00:00"
"475","fG1N5kzeAhM","Dear Future Me (Scheduled Uploaded 6 Months Ago)","Dear future me, please do not be dead. Btw I also made a video for 1 and 10 years in the future!",2016-04-04 19:30:01,"youtube#video",145,2359615,134610,12523,"2025-02-13 00:02:01.489061+00:00"
"476","vT_gRRMjDi0","$100 GIVEAWAY PRANK (NO WEAPONS INVOLVED)","My last video was a fake giveaway and now I trick people into thinking they won.",2016-04-03 21:00:00,"youtube#video",291,67673,1839,235,"2025-04-28 00:03:09.151500+00:00"
"477","dfcPUqiivDY","GIVING AWAY $100 ITUNES GIFT CARDS","FOLLOW TO ENTER - https://twitter.com/MrBeastYT Insane $100 Itunes Gift Card Giveaway!",2016-04-01 20:45:18,"youtube#video",130,108638,3540,457,"2023-08-27 00:12:06.324381+00:00"
"478","zCR6DJX7Kak","Walking Dead Daryl DIED (Fan Reaction To Death)","I love the walking dead and Daryl's death has me mentally depressed. Thanks The Walking Dead for ruining my life. Walking ...",2016-03-28 02:10:15,"youtube#video",43,160451,4412,522,"2024-08-10 00:08:46.401105+00:00"
"479","4cX-w-ia0RU","Why Do Youtubers Ask For Likes?","Why do youtubers ask for likes? Well you see, every like a video gets summons a unicorn... so yeah. RPS Rock ...",2016-03-27 21:50:19,"youtube#video",201,177287,12047,665,"2025-04-08 00:08:53.637499+00:00"
"480","8ZTy3K2QgOY","Pranks That Went Horribly Wrong","These are pranks that went horribly wrong, warning guns were pulled. SOURCES BELOW ...",2016-03-19 21:00:00,"youtube#video",274,2142675,90344,2937,"2025-03-15 00:02:33.960815+00:00"
"481","k9zko79_3_I","Who Founded Faze? Who Created Faze Clan?","Who Founded Faze and who created faze clan are two really common questions that I answer in this video. NEW Merch Store!",2016-03-18 00:23:07,"youtube#video",325,2028268,72955,3822,"2024-05-03 00:06:02.444809+00:00"
"482","fYnPyLfxSJg","Subscriber Goals For 2017","How many subscribers will you have in 2017? Comment your goal! RPS Rock ...",2016-03-09 23:35:32,"youtube#video",234,64512,2441,1290,"2023-12-11 00:06:37.374405+00:00"
"483","pBH_QL4JGcI","20,000","20000 people where dumb enough to subscribe to me. NEW Merch Store! - https://mrbeast.store Check out Viewstats!",2016-03-08 00:35:01,"youtube#video",256,161872,5409,771,"2024-04-07 00:08:14.082969+00:00"
"484","1wtFD9zSQO8","The Dreaded Unanswerable Question","The worst question ever The tweet - https://twitter.com/MrBeastYT/status/704109618952314881 Expand for RPS Rock ...",2016-02-29 23:56:41,"youtube#video",270,178464,4777,348,"2025-04-09 00:04:24.705721+00:00"
"485","VqhjiwmGNKA","WORST THUMBNAILS ON YOUTUBE","These are the worst thumbnails on youtube RPS Rock ...",2016-02-28 20:48:25,"youtube#video",156,611712,24535,1132,"2025-04-15 00:00:59.391066+00:00"
"486","EhZ9gHZOZT8","Beast Goes Camping (Didn&#39;t Go Wrong) (Didn&#39;t Go Sexual)","I went camping and yeah NEW Merch Store! - https://mrbeast.store Check out Viewstats! - https://www.viewstats.com/ For any ...",2016-02-20 23:07:55,"youtube#video",285,199273,5061,363,"2025-04-13 00:04:39.670563+00:00"
"487","LHtkve6-O0g","NBA Interviews Gone Wrong (No Gun Pulled)","NBA interviews gone wrong. We were bored and thought this was funny! My Friend - https://www.youtube.com/user/antharris08 ...",2016-02-20 14:56:51,"youtube#video",154,66610,1986,153,"2025-04-15 00:00:59.391066+00:00"
"488","m3Ol8zn7brk","Movie Trailers Be Like","This is a parody of most movie trailers. Like the video for laptop 1.0! NEW Merch Store! - https://mrbeast.store Check out Viewstats!",2016-02-15 18:31:34,"youtube#video",102,107795,4424,264,"2025-01-05 00:04:16.500428+00:00"
"489","NeOrh4GnPZ4","Things I Hate #2 - Youtube Edition","If this video hits 500 likes I will upload a sexual prank in the hood and if that hits 420000 likes I will make a shout out sunday!",2016-02-09 01:26:28,"youtube#video",268,159565,7322,1459,"2024-04-07 00:08:14.082969+00:00"
"490","9Ax56oRhcZc","Counting To 10000 In One Sitting","Counting To 10000 In One Sitting NEW Merch Store! - https://mrbeast.store Check out Viewstats! - https://www.viewstats.com/ For ...",2016-02-01 00:27:55,"youtube#video",12581,68298763,716116,57379,"2025-02-02 00:06:39.407045+00:00"
"491","z7qtJAAV5d0","Is Obama Dead? Dumb Google Searches!","Is Obama Dead? Dumb Google Searches! Open for Rock Paper Bomb Rock ...",2016-01-24 00:21:47,"youtube#video",324,228492,4690,284,"2025-04-28 00:03:09.151500+00:00"
"492","9pk-neTrDoM","How To Be MrBeast (Made By Really Old Subscriber)","How to be like MrBeast. This video had me dead XD His channel ...",2016-01-23 19:46:56,"youtube#video",321,66585,2770,290,"2024-09-19 00:03:00.262763+00:00"
"493","JQscW6DfNZY","Should You Play Video Games?","Should you play video games is the topic of this video and I would love to hear what you guys have to say!",2016-01-22 17:04:58,"youtube#video",179,97936,4262,188,"2025-04-28 00:03:09.151500+00:00"
"494","9smE_EiKJ8Q","School Is A Waste Of Time","School Is A Waste Of Time is my opinion and I would love to hear yours! NEW Merch Store! - https://mrbeast.store Check out ...",2016-01-21 22:45:37,"youtube#video",174,133338,5796,734,"2025-04-28 00:03:09.151500+00:00"
"495","hfaPkoXeYfU","Is Michael Bay My Dad????????","Son can I be in your next movie? Rock Paper Scissors for Mobile Below Rock - https://www.youtube.com/watch?v=XItPMw8tLUI ...",2016-01-18 21:46:21,"youtube#video",106,62975,2071,248,"2023-08-27 00:12:06.324381+00:00"
"496","u0hHxeWkB_o","Lottery Taxes - How Much Tax Is If You Win The Lottery","Lottery taxes are really high, so if you think you will ever win this is how much money you would actually get to keep.",2016-01-16 19:25:35,"youtube#video",220,135712,3653,256,"2025-04-14 00:09:50.838112+00:00"
"497","64WGWubQO3I","Motivation For Small Youtubers #3","Are you a small youtuber? Need some motivation? Watch this. NEW Merch Store! - https://mrbeast.store Check out Viewstats!",2016-01-12 00:57:36,"youtube#video",211,177605,9264,1238,"2025-02-02 00:06:39.407045+00:00"
"498","QJUs6CSRCFU","Giving Away Two $15 Gift Cards (forgive me boyz)","1.) Follow me for $15 - https://twitter.com/MrBeastYT 2.) Retweet for $15 ...",2016-01-10 23:32:03,"youtube#video",191,48844,2814,573,"2024-05-28 00:06:36.843943+00:00"
"499","Om4c4ilT_6g","Do Dislikes Matter On Youtube - Are Dislikes Bad Or Good?","Do Dislikes Matter On Youtube - Are Dislikes Bad Or Good? That is what I answer in this video! NEW Merch Store!",2016-01-07 22:19:01,"youtube#video",264,381185,23877,2043,"2025-04-13 00:04:39.670563+00:00"
"500","yzxYCRDcGDs","Reaction Channels Are Stupid??????? #JCTG","Reaction channels are stupid is what many people say but is that really true?",2016-01-05 01:49:06,"youtube#video",194,60798,1878,416,"2023-12-12 00:14:29.153552+00:00"
"501","PCakYf_PnT0","Goodbye Laptop","I got a new laptop! NEW Merch Store! - https://mrbeast.store Check out Viewstats! - https://www.viewstats.com/ For any questions ...",2016-01-01 23:49:09,"youtube#video",136,166897,6963,619,"2025-04-09 00:04:24.705721+00:00"
"502","8nv_ltg4RAg","2015 Year Highlights","This was a gud year boyz →→ FOLLOW FOR GOOD LUCK→→ https://twitter.com/MrBeastYT → →FACEBOOK→ ...",2015-12-30 20:18:43,"youtube#video",243,58762,2134,513,"2023-12-11 00:06:37.374405+00:00"
"503","JP3v6UxI124","How To Think Of Good Video Ideas (Tips)","How to think of good videos ideas is what I talk about in this video, and hopefully I can help you guys out!",2015-12-26 17:38:52,"youtube#video",373,124616,7857,528,"2025-04-13 00:04:39.670563+00:00"
"504","jRURlbRAUhI","Whats That Song Name?","Whats That Song? Outro piano song - https://www.youtube.com/watch?v=vVTP0DOL_2Q Duhhhhh ...",2015-12-24 17:01:11,"youtube#video",112,185026,7355,1471,"2023-12-12 00:14:29.153552+00:00"
"505","I_3R9YGFlHE","The Anti-Beast","FOLLOW FOR GOOD LUCK→→ https://twitter.com/MrBeastYT → →FACEBOOK→ https://www.facebook.com/MrBeast6000 ...",2015-12-23 23:51:22,"youtube#video",159,885225,29267,1745,"2024-12-25 00:01:17.533098+00:00"
"506","xjJJ_wDlc1E","Reacting To Family Accounts (MamaBeast, MrBeast&#39;sLaptop, Etc)","In this video, I react to fan accounts!",2015-12-22 22:30:23,"youtube#video",595,920354,20159,2023,"2023-09-21 00:08:27.352542+00:00"
"507","cqirhwhq_qM","Do Youtubers Pay Taxes????? (USA)","Have you ever wondered if youtubers have to pay taxes? Well that is what I talk about in this video! SOURCE OF INFORMATION ...",2015-12-19 19:21:52,"youtube#video",391,108996,4419,414,"2025-04-13 00:04:39.670563+00:00"
"508","3IQdDBwc42o","Why Does This Video Have No Thumbnail?","Why no thumbnail?",2015-12-15 01:43:00,"youtube#video",181,97718,4056,433,"2025-04-13 00:04:39.670563+00:00"
"509","uxzBq4Y_fNw","Exams Be Like","This is your typical highschooler's thoughts on exams.",2015-12-10 00:15:18,"youtube#video",234,442611,13634,1033,"2024-12-26 00:01:05.562533+00:00"
"510","HIhUkvAG0o4","How Many People Have A Silver Play Button????","Have you ever wondered how many people have a silver play button? Well that is what I talk about in this video!",2015-12-08 22:22:47,"youtube#video",213,424956,12193,792,"2024-12-27 00:06:19.816655+00:00"
"511","6zQhLOw1nw8","Should You Do COD Commentaries In 2016????","Should you do COD commentaries in 2016?",2015-12-02 23:51:26,"youtube#video",227,55420,1392,282,"2025-02-02 00:06:39.407045+00:00"
"512","mfvi_jgdVqE","THINGS I HATE #1","I am a spoiled white kid that complains about first world problems.",2015-12-02 01:20:16,"youtube#video",220,474897,15695,1658,"2025-04-28 00:03:09.151500+00:00"
