"","id","title","description","publishTime","kind_stats","duration_seconds","viewCount","likeCount","commentCount","pull_date"
"1","uyiG6uw-6pA","Would You Risk Drowning for $500,000?","These were crazy dangerous so everything was performed under professional supervision Jack Link's Jerky can fuel anything.",2025-04-26 16:00:00,"youtube#video",1546,45397419,1516182,24837,"2025-04-28 00:03:09.151500+00:00"
"2","M1STzb7k9L8","Extreme Helmet Game","",2025-04-25 16:15:00,"youtube#video",23,61404005,910075,3034,"2025-04-28 00:03:09.151500+00:00"
"3","7K-yxGWYsnk","$10,000 Human Shuffleboard","",2025-04-22 16:30:14,"youtube#video",40,119932405,2067999,3025,"2025-04-27 00:02:44.651322+00:00"
"4","Tbn4cYCaZCk","Drift This Car, Win $10,000","",2025-04-16 17:00:15,"youtube#video",20,240053679,3868988,7137,"2025-04-28 00:03:09.151500+00:00"
"5","","Philanthropy","",2025-04-15 21:09:25,"",0,NA,NA,NA,"2025-04-18 00:06:03.806800+00:00"
"6","figrl0aOULs","Watch This Video To Feed 1 Person In Need","Buying 1 Hoodie = 100 Meals for people in need! Go get it now: https://www.doordash.com/p/dashmart-near-me Thank you ...",2025-04-12 16:00:01,"youtube#video",629,49564829,3510587,66385,"2025-04-28 00:03:09.151500+00:00"
"7","Uxc84UUrVHk","You Can Stop Child Labor","",2025-04-11 16:00:01,"youtube#video",58,55016142,2458485,14887,"2025-04-28 00:03:09.151500+00:00"
"8","BzKaMelDzqo","How Fast Can I Go?","New Merch - https://mrbeast.store Check out Viewstats! - https://www.viewstats.com/ SUBSCRIBE OR I TAKE YOUR DOG ...",2025-04-05 16:00:12,"youtube#video",18,113508949,2103676,7122,"2025-04-27 00:02:44.651322+00:00"
"9","4yx9ZJDfyKk","Baseball Tic Tac Toe vs MLB Pro","I wish I was as good as AaronJudge BUT if you're a @TMobile member and wanna watch him crush it all regular season long ...",2025-03-27 16:00:00,"youtube#video",27,43568467,1233960,7296,"2025-04-28 00:03:09.151500+00:00"
"10","kPa_S6jN9ls","Could You Win This Obstacle Course?","ad.",2025-03-25 16:15:01,"youtube#video",34,61841347,1310859,9953,"2025-04-28 00:03:09.151500+00:00"
"11","69g-YcbmgQA","Find Your Dog, Win $10,000","",2025-03-23 16:00:01,"youtube#video",36,235807773,8320433,7797,"2025-04-28 00:03:09.151500+00:00"
"12","aKq8bkY5eTU","I Survived The 5 Deadliest Places On Earth","It's crazy we actually did this Our new Feastables Peanut Butter Cups roll out over the next two weeks into every Target, Walmart, ...",2025-03-22 16:00:00,"youtube#video",803,104191132,2672603,52030,"2025-04-28 00:03:09.151500+00:00"
"13","TNtpUQbW4mg","This Is How The Pyramids Were Built","",2025-03-18 16:00:00,"youtube#video",13,144869912,5307726,13848,"2025-04-28 00:03:09.151500+00:00"
"14","TgCm8oDmxOk","I Crashed One Of The Most Expensive Cars In The World","",2025-03-14 16:00:00,"youtube#video",16,66404867,2050143,6401,"2025-04-28 00:03:09.151500+00:00"
"15","954wJ3uHVAk","Last One To Fall Wins","",2025-03-08 18:05:23,"youtube#video",30,97349358,3411278,7402,"2025-04-28 00:03:09.151500+00:00"
"16","zajUgQLviwk","Last to Leave Their Circle Wins $500,000","Seeing these past contestants battle it out for $500000 was wild Launch a store on Shopify and I'll buy from 100 random stores ...",2025-03-01 17:00:01,"youtube#video",2318,108186491,2365823,73975,"2025-04-28 00:03:09.151500+00:00"
"17","PXevNM0awlI","Highest Away From Me Wins $10,000","",2025-02-28 17:00:00,"youtube#video",50,243863751,8170255,9184,"2025-04-28 00:03:09.151500+00:00"
"18","PuQ5UxKUY48","Find The Human, Win $10,000","",2025-02-24 17:00:02,"youtube#video",41,182183225,5722554,7095,"2025-04-28 00:03:09.151500+00:00"
"19","L5ihmu87xTE","Find This Stranger, Win $10,000","",2025-02-19 18:00:00,"youtube#video",61,313958883,12346416,9594,"2025-04-28 00:03:09.151500+00:00"
"20","nAiKLoCP-kU","Reach the Money, Win $10,000","",2025-02-14 18:15:00,"youtube#video",25,256832584,6032053,7212,"2025-04-28 00:03:09.151500+00:00"
"21","NDsO1LT_0lw","I Spent 100 Hours Inside The Pyramids!","I can't believe we were allowed to do this Season 2 of swarms is out now! You can even find a Gold Swarm worth $10000!",2025-02-08 17:00:00,"youtube#video",1303,182804203,5057776,99201,"2025-04-28 00:03:09.151500+00:00"
"22","sF5LYGgKbUA","Every Minute One Person Is Eliminated","Watch Beast Games now on Prime Video: https://www.beastgames.com New Merch - https://mrbeast.store Check out Viewstats!",2025-01-25 17:00:01,"youtube#video",2086,110412272,2762653,72091,"2025-04-28 00:03:09.151500+00:00"
"23","MFpWEKN9c6Y","Last Person Hanging Wins $10,000","",2025-01-21 17:00:03,"youtube#video",43,326511666,10325862,11645,"2025-04-28 00:03:09.151500+00:00"
"24","TRxMLLuWIhw","Subscribe For An iPhone","Terms and Conditions: https://bit.ly/MrBeastIphone.",2025-01-17 17:00:00,"youtube#video",17,144336320,17153131,173744,"2025-04-28 00:03:09.151500+00:00"
"25","SM66GDRyIVY","I Helped 2,000 People Walk Again","Thank you for making this video possible ROMP: https://rompglobal.org/beastmode Martin Bionics: ...",2025-01-11 17:00:02,"youtube#video",931,100976811,2796500,53069,"2025-04-28 00:03:09.151500+00:00"
"26","EvqtfK_RaRg","This obstacle course is WILD","",2025-01-10 17:00:00,"youtube#video",32,126225719,3247380,4818,"2025-04-28 00:03:09.151500+00:00"
"27","3cWm9B_0_kI","How Many People To Stop Ronaldo?","",2024-12-27 19:00:00,"youtube#video",21,297087083,9534758,21639,"2025-04-28 00:03:09.151500+00:00"
"28","qtWqHIx8Z-o","Last Person Standing Wins $10,000","",2024-12-22 17:00:01,"youtube#video",48,380035319,10715532,7567,"2025-04-28 00:03:09.151500+00:00"
"29","gs8qfL9PNac","2,000 People Fight For $5,000,000","Watch Beast Games now on Prime Video: https://www.beastgames.com Thank you to @MoneyLion for partnering with me on ...",2024-12-19 17:00:00,"youtube#video",1485,167874591,4443663,49921,"2025-04-28 00:03:09.151500+00:00"
"30","Fa2fBRhy1jM","Fight For $5,000,000","",2024-12-14 18:00:01,"youtube#video",25,31118425,2367571,8315,"2025-01-28 00:07:50.573643+00:00"
"31","DBPYB8WkkDc","Bring Me Back Snow From The North Pole","ad https://www.amazon.com/redone.",2024-12-10 17:00:00,"youtube#video",55,348393456,14247072,10379,"2025-04-28 00:03:09.151500+00:00"
"32","zvBXpoBegwE","I Got T-Series To Subscribe To Me","",2024-12-09 17:00:01,"youtube#video",31,116930922,6749146,11793,"2025-04-28 00:03:09.151500+00:00"
"33","LJDN7dzrErg","Never Doing This Again…","",2024-12-03 17:30:00,"youtube#video",8,19287154,1091560,3405,"2024-12-17 00:08:24.647251+00:00"
"34","SWc8fI_9iqA","Ronaldo Teaches Me How To SIUU","",2024-12-01 17:00:00,"youtube#video",15,221554193,8064213,29546,"2025-04-28 00:03:09.151500+00:00"
"35","0BjlBnfHcHM","Beat Ronaldo, Win $1,000,000","I still can't believe we got all of these athletes for this Thanks Yahoo Sports for sponsoring. Enter for a chance to meet me at one of ...",2024-11-30 17:00:00,"youtube#video",1365,259935665,7535518,113233,"2025-04-28 00:03:09.151500+00:00"
"36","HcL1EQ5qD_g","Confronting Ronaldo","",2024-11-29 17:30:10,"youtube#video",21,160089643,10743807,19760,"2025-04-28 00:03:09.151500+00:00"
"37","yf_C8penA9k","Giving A Stranger $1,000,000","",2024-11-20 17:00:01,"youtube#video",35,33863144,2099171,4919,"2024-11-30 00:01:54.786714+00:00"
"38","dc089EZRGcg","How Many Balloons To Make A Store Fly?","ad.",2024-11-18 19:00:00,"youtube#video",22,350172028,9650973,9732,"2025-04-28 00:03:09.151500+00:00"
"39","vXNtju4VFm4","Restocking MrBeast Labs at Walmart","",2024-11-18 17:00:00,"youtube#video",36,192218367,4429211,3324,"2025-04-28 00:03:09.151500+00:00"
"40","I9mw5UlDyPI","This Game Is Wild...","",2024-11-12 17:00:00,"youtube#video",19,516097687,12360704,7678,"2025-04-28 00:03:09.151500+00:00"
"41","pS-fFdvyHLE","How Much Tape To Stop A Lamborghini?","",2024-11-08 17:00:00,"youtube#video",15,576287832,13044884,17362,"2025-04-13 00:04:39.670563+00:00"
"42","Xj0Jtjg3lHQ","$1 vs $500,000 Experiences!","I didn't know some of these were possible MrBeast Lab Swarms are flying off the shelves! Grab yours now at Walmart, Target, ...",2024-11-02 16:00:00,"youtube#video",1060,233559105,4896128,55729,"2025-04-28 00:03:09.151500+00:00"
"43","HHV4WT8AA1w","Can You Surf A Pool Table?","",2024-10-30 16:00:00,"youtube#video",23,34875659,1713149,5271,"2024-11-12 00:04:35.428218+00:00"
"44","9UtcHPCEBgg","1 Subscriber = 1 Penny","",2024-10-19 18:00:00,"youtube#video",17,285033671,15299902,20996,"2025-04-28 00:03:09.151500+00:00"
"45","ZNt_GoOBHq8","Human vs Jet Engine","",2024-10-17 19:00:00,"youtube#video",19,433038447,12528538,15547,"2025-04-28 00:03:09.151500+00:00"
"46","bn0Kh9c4Zv4","7 Days Exploring An Underground City","This salt mine is the coolest underground city I've ever seen Get Zaxbys MrBeast Box while you still can - Chicken Fingerz™, ...",2024-10-12 16:00:00,"youtube#video",1235,142507897,3487797,31888,"2025-04-28 00:03:09.151500+00:00"
"47","dDVFnfCwjHA","Will A Basketball Boat Hold My Weight?","",2024-10-11 16:00:01,"youtube#video",30,298849644,9202502,5847,"2025-04-18 00:06:03.806800+00:00"
"48","Kt2HvqRruHQ","Find The Real MrBeast, Win $10,000","",2024-10-05 16:00:00,"youtube#video",37,265101202,9240586,6271,"2025-04-28 00:03:09.151500+00:00"
"49","IHNQhb-mjZc","How Many Twins Can You Spot?","",2024-10-03 18:00:01,"youtube#video",17,26276222,1240929,2270,"2024-10-13 00:01:09.671294+00:00"
"50","vDrSCXFMAKk","Spot The Difference, Win $10,000","",2024-09-28 20:00:00,"youtube#video",58,195816404,7372427,4792,"2025-04-07 00:04:51.143965+00:00"
"51","snX5YyflrGw","100 Identical Twins Fight For $250,000","I've never seen this many twins in one place before lol Our brand new flavor is here: Cookies & Creme, made with rich chocolatey ...",2024-09-28 16:00:00,"youtube#video",2140,151452175,3175298,27369,"2025-04-27 00:02:44.651322+00:00"
"52","nbzQdlWrcnk","Running With Bigger And Bigger Lunchlys","",2024-09-20 16:00:00,"youtube#video",18,275490932,7748794,9577,"2025-04-28 00:03:09.151500+00:00"
"53","8krJy31Diow","Holding Bigger And Bigger Dogs","",2024-09-16 18:00:00,"youtube#video",17,253551510,7444736,8257,"2025-04-28 00:03:09.151500+00:00"
"54","aRcUVhVlSHg","Men Vs Women Survive The Wilderness For $500,000","Some of these strategies were wild! Wet things clean better than dry things, so ditch the toilet paper and get confidently clean with ...",2024-09-07 16:00:00,"youtube#video",1908,169073880,3997561,49182,"2025-04-28 00:03:09.151500+00:00"
"55","Jo7sfpeWqwE","Will A Guitar Boat Hold My Weight?","",2024-09-05 16:00:01,"youtube#video",20,671340782,17562571,14638,"2025-04-28 00:03:09.151500+00:00"
"56","QtD-CeUdRUQ","Real Or Cake For $10,000","",2024-08-29 16:00:00,"youtube#video",37,167393978,6889119,13626,"2025-04-28 00:03:09.151500+00:00"
"57","ndAQfTzlVjc","7 Days Stranded In A Cave","I didn't think surviving in a cave would be that challenging Check out Swarms! It's the coolest collectible ever with over 100 ...",2024-08-17 16:00:00,"youtube#video",1079,147746133,4440908,93232,"2025-04-28 00:03:09.151500+00:00"
"58","AydS-vA3qa4","Running With Bigger And Bigger Feastables","",2024-08-15 23:00:00,"youtube#video",17,385637314,11803443,29052,"2025-04-28 00:03:09.151500+00:00"
"59","UPrkC1LdlLY","Survive 100 Days In Nuclear Bunker, Win $500,000","This video was really fun to make, I hope you enjoy it :) Download Monster Hunter Now and take on my hunting challenge ...",2024-08-03 16:00:00,"youtube#video",1941,278731964,5876700,85946,"2025-04-28 00:03:09.151500+00:00"
"60","8bTQMDM4qvY","Spot The Fake Animal For $10,000","",2024-07-19 16:00:00,"youtube#video",40,504096761,16043704,27926,"2025-04-28 00:03:09.151500+00:00"
"61","DBw0oD38z0Q","This Game Is Wild","",2024-07-17 16:00:00,"youtube#video",21,210735442,6018475,11881,"2025-04-28 00:03:09.151500+00:00"
"62","4SNThp0YiU4","50 YouTubers Fight For $1,000,000","I can't believe how intense this video got The Samsung Galaxy Ring and Z Flip6 blew my mind in this video – you've gotta check ...",2024-07-13 16:00:01,"youtube#video",2487,353477498,9287987,346220,"2025-04-28 00:03:09.151500+00:00"
"63","XhuisK0bTSA","Pass The Phone To…","",2024-07-11 17:00:01,"youtube#video",60,212760430,10481134,49553,"2025-04-28 00:03:09.151500+00:00"
"64","lkCRPp7cnP8","How Many Balloons Does It Take To Fly?","",2024-07-10 17:00:00,"youtube#video",18,487957168,19853427,50809,"2025-04-28 00:03:09.151500+00:00"
"65","KkCXLABwHP0","I Built 100 Houses And Gave Them Away!","Thank you for making this video possible Techo: https://techo.org/ FFTP: https://foodforthepoor.org/housing-jamaica/ New Story: ...",2024-06-29 16:00:00,"youtube#video",576,189300036,7610014,289507,"2025-04-28 00:03:09.151500+00:00"
"66","PWirijQkH4M","World’s Deadliest Obstacle Course!","The obstacles in this video only get crazier as it goes on… Head to Walmart for Cirkul's BIGGEST. DROP. EVER. ⌛️ (while ...",2024-06-15 16:00:01,"youtube#video",1705,311055829,6461851,143402,"2025-04-28 00:03:09.151500+00:00"
"67","U_LlX4t0A9I","$10,000 Every Day You Survive In The Wilderness","They survived longer than I expected lol Feast like a Beast with Zaxby's new MrBeast Box, served with 4 Chicken Fingerz™, ...",2024-06-01 16:00:00,"youtube#video",1570,272748206,8184347,331985,"2025-04-28 00:03:09.151500+00:00"
"68","T8I165Qxeo8","Sprinting with More and More Money","",2024-05-30 16:00:01,"youtube#video",29,300605008,11802965,85487,"2025-04-27 00:02:44.651322+00:00"
"69","i-9V21MqlhY","Giving 1000 Phones Away","",2024-05-28 16:00:00,"youtube#video",18,291911718,21930673,798700,"2025-04-28 00:03:09.151500+00:00"
"70","YyNz4--6fro","World’s Smartest Dog","",2024-05-16 16:00:00,"youtube#video",12,218248723,9688314,33361,"2025-04-28 00:03:09.151500+00:00"
"71","f0cXJ6mJxGc","Bottle Head Smashing World Record Attempt!","",2024-05-14 16:00:00,"youtube#video",38,452151904,12169697,48844,"2025-04-28 00:03:09.151500+00:00"
"72","F6PqxbvOCUI","Protect The Yacht, Keep It!","This video did not go how I expected it to Craft your perfect defense from a combination of powerful Monkey Towers and awesome ...",2024-05-11 16:00:00,"youtube#video",908,149641068,4112960,80764,"2025-04-28 00:03:09.151500+00:00"
"73","oA4LSZvX4iE","Ages 1-100 Try My Chocolate","",2024-05-09 16:00:00,"youtube#video",39,243015017,9498733,33662,"2025-04-27 00:02:44.651322+00:00"
"74","ZKxnjszkZto","Spot The Hidden People For $10,000","",2024-05-08 16:00:01,"youtube#video",35,185551522,6242157,11697,"2025-04-28 00:03:09.151500+00:00"
"75","8_gdcaX9Xqk","Would You Split Or Steal $250,000?","",2024-05-03 16:00:00,"youtube#video",60,187988725,11031426,28096,"2025-04-28 00:03:09.151500+00:00"
"76","snUyLbGx6U4","Buy Feastables, Win Unlimited Money","",2024-04-30 16:00:00,"youtube#video",51,309213075,11487255,24782,"2025-04-28 00:03:09.151500+00:00"
"77","Pv0iVoSZzN8","In 10 Minutes This Room Will Explode!","I didn't expect that to happen… There's no jumping through hoops (or plate glass windows) with T-Mobile. Customers can get ...",2024-04-27 16:00:00,"youtube#video",600,150010559,4107218,78155,"2025-04-28 00:03:09.151500+00:00"
"78","CWbV3NItSdY","The World&#39;s Fastest Cleaners","",2024-04-25 16:00:03,"youtube#video",35,663959813,26049826,42498,"2025-04-28 00:03:09.151500+00:00"
"79","VLqZUENAFY4","Deal or No Deal with Howie Mandel","",2024-04-23 16:00:01,"youtube#video",44,23249508,1496066,6689,"2024-05-10 00:06:05.649076+00:00"
"80","l-nMKJ5J3Uc","Ages 1 - 100 Decide Who Wins $250,000","I can't believe who they picked Thanks Top Troops for sponsoring this video. Download Top Troops at ...",2024-04-20 15:59:59,"youtube#video",2402,270698763,6025101,210597,"2025-04-27 00:02:44.651322+00:00"
"81","XE1Qyss8GIY","Guess The Gift, Keep It","",2024-04-09 17:00:00,"youtube#video",46,480384766,18451177,23502,"2025-04-28 00:03:09.151500+00:00"
"82","6GzHPS0rEgc","I’m Giving My 250M Subscriber $25,000","",2024-04-06 19:45:00,"youtube#video",21,113889273,7626479,50420,"2025-04-28 00:03:09.151500+00:00"
"83","imhY0pe-Sd8","Anything You Touch, You Keep!","",2024-04-02 16:00:03,"youtube#video",48,227999886,9853693,15124,"2025-04-28 00:03:09.151500+00:00"
"84","erLbbextvlY","7 Days Stranded On An Island","I can't believe we actually did this Play the Official Fortnite Creative Map For This Video Here: MrBeast Zombie Island ...",2024-03-30 16:00:01,"youtube#video",1346,342747633,6848838,143341,"2025-04-28 00:03:09.151500+00:00"
"85","OnTTThIzuNU","Keep Track Of Car, Win $10,000","",2024-03-19 16:00:00,"youtube#video",51,162653586,7699471,89069,"2025-04-28 00:03:09.151500+00:00"
"86","mKdjycj-7eE","Protect The Lamborghini, Keep It!","I still can't believe what happened in this video lol Check out the mind-blowing Galaxy AI on the Samsung Galaxy S24 Ultra.",2024-03-16 16:00:00,"youtube#video",1141,207256070,5165097,124043,"2025-04-28 00:03:09.151500+00:00"
"87","tWYsfOSY9vY","I Survived 7 Days In An Abandoned City","This was one of the hardest challenges we've ever done A deal so good it feels like stealing - score a FREE double insulated ...",2024-03-02 17:00:00,"youtube#video",1044,270475299,6342433,198592,"2025-04-28 00:03:09.151500+00:00"
"88","sH48lKbayNU","Unboxing My 200M Subscriber Play Button","",2024-02-29 17:00:00,"youtube#video",46,222576838,13902757,49678,"2025-04-28 00:03:09.151500+00:00"
"89","AFXoSFNMwIA","I Filled Chandler’s Car With Feastables","",2024-02-27 18:00:01,"youtube#video",38,354310699,13653816,25463,"2025-04-28 00:03:09.151500+00:00"
"90","k194wHZHjB0","Most Expensive Hand Model Holds Feastables","",2024-02-24 18:00:09,"youtube#video",22,379654083,10478508,7767,"2025-04-28 00:03:09.151500+00:00"
"91","AjwAdtlRKf8","Buy Feastables, Win $10,000","",2024-02-17 19:00:01,"youtube#video",41,343924117,14834229,31309,"2025-04-28 00:03:09.151500+00:00"
"92","KOEfDvr4DcQ","Face Your Biggest Fear To Win $800,000","I can't believe how far he got Face your fears and start your business on Shopify right now https://shopify.com/mrbeast Update: ...",2024-02-10 17:00:00,"youtube#video",1323,308177518,6298099,223668,"2025-04-28 00:03:09.151500+00:00"
"93","krsBRQbOPQ4","$1 vs $250,000,000 Private Island!","Watch until the end to see how crazy the last island is Play my ALL NEW MrBeast's Disco Dop level in Stumble Guys today!",2024-01-27 17:00:00,"youtube#video",1019,311826989,5669858,100737,"2025-04-28 00:03:09.151500+00:00"
"94","7ESeQBeikKs","Protect $500,000 Keep It!","He spent so much money lol Grow your money with the Mighty Oak debit card from Acorns. Sign up at ...",2024-01-13 17:00:00,"youtube#video",934,171016449,4687121,70260,"2025-04-28 00:03:09.151500+00:00"
"95","K_CbgLpvH9E","I Spent 7 Days In Solitary Confinement","I started going insane at the end of this challenge Bet you can't guess MrBeast's favorite flavor - find out & get one for FREE at ...",2023-12-30 17:00:03,"youtube#video",1216,224545856,5129472,79562,"2025-04-28 00:03:09.151500+00:00"
"96","lOKASgtr6kU","I Saved 100 Dogs From Dying","I'm so happy all of these dogs will be going to great homes Get an exclusive Surfshark VPN deal! Enter promo code MRBEAST for ...",2023-12-23 17:00:00,"youtube#video",903,301962710,6208509,104028,"2025-04-28 00:03:09.151500+00:00"
"97","9RhWXPcKBI8","Survive 100 Days Trapped, Win $500,000","This video got crazier the longer we kept filming lol Don't miss your chance to get on MrBeast's gift list! Submit your wish in the ...",2023-12-16 17:00:01,"youtube#video",1628,361825709,6521305,93329,"2025-04-17 00:03:00.167840+00:00"
"98","ZVt9ZJfWV1c","Feeding A Dog $1 vs $10,000 Steak","",2023-12-14 18:00:00,"youtube#video",27,478613889,14850695,29459,"2025-04-28 00:03:09.151500+00:00"
"99","rWBOITBjitE","Could You Walk Up A Skyscraper?","",2023-12-05 18:00:00,"youtube#video",50,354399874,14143899,27191,"2025-04-28 00:03:09.151500+00:00"
"100","tnTPaLOaHz8","$10,000 Every Day You Survive In A Grocery Store","I didn't expect him to stay that long Shop Kanga Coolers, powered by Shopify: https://go.shop.app/kangacoolers Special thanks to: ...",2023-12-02 17:00:00,"youtube#video",1292,390063350,6860163,83371,"2025-04-28 00:03:09.151500+00:00"
"101","Wdjh81uH6FU","$1 vs $10,000,000 Job!","I can't believe they actually hired me lol Try Immortals of Aveum today with a free trial for Playstation 5 and Xbox Series X|S, and a ...",2023-11-25 17:00:00,"youtube#video",939,249579383,4631262,61240,"2025-04-28 00:03:09.151500+00:00"
"102","7dYTw-jAYkY","I Spent 7 Days Buried Alive","Please don't try this at home lol Verizon 5G Home Internet for as low as $35/month. Opt-in and you could get a $200 Amazon.com ...",2023-11-18 17:00:01,"youtube#video",1114,249885100,7458139,114056,"2025-04-28 00:03:09.151500+00:00"
"103","AjZDwxt7S8w","I Gave Away A House On Halloween","",2023-11-10 18:00:00,"youtube#video",48,320183835,13357351,35760,"2025-04-28 00:03:09.151500+00:00"
"104","aZnqqXaT02g","Giving Car Keys Instead Of Candy On Halloween","",2023-11-09 18:00:00,"youtube#video",32,342485722,10539912,14458,"2025-04-07 00:04:51.143965+00:00"
"105","mwKJfNYwvm8","I Built 100 Wells In Africa","Click the link below to donate https://www.beastphilanthropy.org/campaign/mrbeast-100-wells New Merch - https://mrbeast.store ...",2023-11-04 16:00:00,"youtube#video",630,236940923,10285140,212792,"2025-04-28 00:03:09.151500+00:00"
"106","l9_8_pDTmis","Furthest Away From Me Wins $10,000","",2023-11-02 17:00:03,"youtube#video",48,604321171,21016762,37412,"2025-04-28 00:03:09.151500+00:00"
"107","n7x4Jj9pdH8","World’s Most Expensive Bed","",2023-10-31 17:00:01,"youtube#video",48,426277532,20028128,33879,"2025-04-28 00:03:09.151500+00:00"
"108","QjvpjXdgugA","World’s Deadliest Laser Maze!","I can't believe what happened at the end… Drink PRIME Hydration, now at Walmart, Target, 7-Eleven, and Kroger Family Stores.",2023-10-28 15:59:59,"youtube#video",1559,260417250,4701902,82573,"2025-04-28 00:03:09.151500+00:00"
"109","jGAJCAuV3pQ","World’s Most Expensive Coffee","",2023-10-19 17:00:03,"youtube#video",33,251161862,11072225,27597,"2025-04-28 00:03:09.151500+00:00"
"110","c0v8OPItCOg","$100,000,000 Bathroom","",2023-10-17 17:00:00,"youtube#video",50,317319425,12213178,21933,"2025-04-28 00:03:09.151500+00:00"
"111","SHOV58tdNiI","Miranda Cosgrove Said What?","",2023-10-15 17:00:00,"youtube#video",15,244287439,12031482,60592,"2025-04-13 00:04:39.670563+00:00"
"112","3ryID_SwU5E","$1 vs $100,000,000 House!","I can't believe how expensive the last house is In case you want to buy the $139000000 House...",2023-10-14 16:00:00,"youtube#video",1023,330182322,6055589,131426,"2025-04-28 00:03:09.151500+00:00"
"113","IemzxkkzI5s","I Tipped A Pizza Delivery Driver A Car","",2023-10-12 17:30:03,"youtube#video",52,590190910,25582443,33216,"2025-04-28 00:03:09.151500+00:00"
"114","3OFj6l2tQ9s","World&#39;s Most Dangerous Trap!","I can't believe how crazy the last room is Grab my FREE Jail Time Jimmy skin when you download Stumble Guys! Jump into the ...",2023-10-07 16:00:00,"youtube#video",1174,295984272,6548419,149654,"2025-04-28 00:03:09.151500+00:00"
"115","bvlFjrcpD6s","I NEED 1 MORE 𝗦𝗨𝗕𝗦𝗖𝗥𝗜𝗕𝗘𝗥","",2023-10-05 17:00:01,"youtube#video",23,401948590,27378231,78403,"2025-04-13 00:04:39.670563+00:00"
"116","AZlBZuS4hr0","Guess The Gift, Keep It","",2023-10-03 17:00:00,"youtube#video",45,831250785,24796585,20402,"2025-04-28 00:03:09.151500+00:00"
"117","Gx6VeIIbWwM","Spot The Hidden People For $10,000","",2023-09-28 17:00:01,"youtube#video",35,686668984,21337358,28395,"2025-04-07 00:04:51.143965+00:00"
"118","CAOY8EKH1qU","I Paid A Random Student’s College Tuition","",2023-09-26 16:59:59,"youtube#video",37,439355318,23946210,55139,"2025-04-26 00:02:13.435310+00:00"
"119","IQxea9UB1nQ","$100,000,000 Car Doors","",2023-09-19 17:00:00,"youtube#video",29,1018454680,27809109,35931,"2025-04-28 00:03:09.151500+00:00"
"120","KrLj6nc516A","$1 vs $100,000,000 Car!","I have no idea why the last car was so expensive See how cool the Samsung Galaxy Z Flip5 is for yourself: ...",2023-09-16 16:00:01,"youtube#video",988,423057154,7498457,150803,"2025-04-28 00:03:09.151500+00:00"
"121","zgLhCT7aFCA","Extreme Home Makeover!","",2023-09-12 17:00:00,"youtube#video",57,359844111,19100157,44162,"2025-04-28 00:03:09.151500+00:00"
"122","L5kIXRdwGAI","Katana Vs Bullet","",2023-09-07 17:00:01,"youtube#video",41,1019423477,36896619,48732,"2025-04-28 00:03:09.151500+00:00"
"123","19NmWqv4Alk","How Many School Buses Can We Stack?","",2023-09-05 16:59:57,"youtube#video",45,463965439,15224189,28142,"2025-04-28 00:03:09.151500+00:00"
"124","vBpQ1SlfVtU","Lamborghini Vs World&#39;s Largest Shredder","who let me do this lol Click here to join Creator League now: http://www.creatorleague.gg/mrbeast Buy a pass before September ...",2023-09-02 16:00:00,"youtube#video",899,231877770,5589794,142767,"2025-04-28 00:03:09.151500+00:00"
"125","SGzWIoLAzmY","Feeding A Cat $10 Vs $10,000 Sushi","",2023-08-31 17:00:00,"youtube#video",31,347494603,13384841,28373,"2025-04-28 00:03:09.151500+00:00"
"126","NnNZLCl78Ao","Make This Kick, Win Super Bowl Tickets","",2023-08-25 16:00:25,"youtube#video",52,135622961,5162600,8827,"2025-04-28 00:03:09.151500+00:00"
"127","NTZhwAldqwg","Metal Pipe Vs School Bus","",2023-08-22 17:00:00,"youtube#video",28,496685344,13681983,28104,"2025-04-13 00:04:39.670563+00:00"
"128","J_z-W4UVHkw","Every Country On Earth Fights For $250,000!","New Merch - https://mrbeast.store Thanks! https://fie.org Check out Viewstats! - https://www.viewstats.com/ SUBSCRIBE OR I TAKE ...",2023-08-19 16:00:01,"youtube#video",1093,232599427,6321554,367097,"2025-04-28 00:03:09.151500+00:00"
"129","mKIhHNznt4s","Can You Beat A Girl In Arm Wrestling?","",2023-08-17 17:00:00,"youtube#video",52,520017831,20518592,37380,"2025-04-28 00:03:09.151500+00:00"
"130","jObOjhUkf50","$1 vs $250,000 Vacation!","I did not expect the $250000 vacation to be that crazy… Thank you teamLab Planets TOKYO for letting us film! Thanks to the ...",2023-08-12 15:59:59,"youtube#video",967,335655956,6485112,106794,"2025-04-28 00:03:09.151500+00:00"
